{
	"$schema": "../printer-definition.schema.json",
    "name": "V0.1",
    "description": "Mini CoreXY printer from Voron Design",
    "manufacturer": "Voron Design",
    "documentationLink": "https://os.ratrig.com/docs/printers/v-minion",
    "image": "voron-v0.png",
    "template": "voron-v01-printer.template.cfg",
    "driverCountRequired": 4,
    "defaults": {
        "board": "btt-skr-mini-e3-30",
        "extruder": "mini-afterburner",
        "hotend": "dragonfly",
        "xEndstop": "endstop",
        "yEndstop": "endstop"
    }
}
